{
    "passes": 2,
    "score": 90,
    "emoji": "✅",
    "history": [
        {
            "task": "codex-process-hardening-2025-12-07",
            "date": "2025-12-07",
            "score": 88
        },
        {
            "task": "codex-process-hardening-2025-12-21",
            "date": "2025-12-21",
            "score": 90
        }
    ]
}
